{
  "schemaVersion": 1,
  "datasetId": "dsh-memory-embedding",
  "datasetVersion": "1.0.0",
  "referenceCommit": "cf9234c4038289f966deef1303edb8a03635da97",
  "evaluationTime": "2026-08-23T00:00:00.000Z",
  "records": [
    { "id": "emb-zh-cinema", "language": "zh", "owner": { "tenantId": "tenant-embedding", "userId": "user-embedding", "agentId": "assistant-embedding" }, "sourceSessionId": "embedding-corpus", "content": "用户周末常去影院观看悬疑影片。", "tags": [], "status": "active", "visibility": "recallable", "createdAt": "2026-08-01T00:00:00.000Z" },
    { "id": "emb-zh-hotel", "language": "zh", "owner": { "tenantId": "tenant-embedding", "userId": "user-embedding", "agentId": "assistant-embedding" }, "sourceSessionId": "embedding-corpus", "content": "出差住宿时首选临近地铁站的旅馆。", "tags": [], "status": "active", "visibility": "recallable", "createdAt": "2026-08-01T00:01:00.000Z" },
    { "id": "emb-zh-running", "language": "zh", "owner": { "tenantId": "tenant-embedding", "userId": "user-embedding", "agentId": "assistant-embedding" }, "sourceSessionId": "embedding-corpus", "content": "用户每天清晨沿河慢跑五公里。", "tags": [], "status": "active", "visibility": "recallable", "createdAt": "2026-08-01T00:02:00.000Z" },
    { "id": "emb-zh-dairy", "language": "zh", "owner": { "tenantId": "tenant-embedding", "userId": "user-embedding", "agentId": "assistant-embedding" }, "sourceSessionId": "embedding-corpus", "content": "遇到乳制品会出现消化不适。", "tags": [], "status": "active", "visibility": "recallable", "createdAt": "2026-08-01T00:03:00.000Z" },
    { "id": "emb-zh-agenda", "language": "zh", "owner": { "tenantId": "tenant-embedding", "userId": "user-embedding", "agentId": "assistant-embedding" }, "sourceSessionId": "embedding-corpus", "content": "重要会议前喜欢把议程打印到纸上。", "tags": [], "status": "active", "visibility": "recallable", "createdAt": "2026-08-01T00:04:00.000Z" },
    { "id": "emb-zh-detergent", "language": "zh", "owner": { "tenantId": "tenant-embedding", "userId": "user-embedding", "agentId": "assistant-embedding" }, "sourceSessionId": "embedding-corpus", "content": "长期使用无香型洗衣液清洗衣物。", "tags": [], "status": "active", "visibility": "recallable", "createdAt": "2026-08-01T00:05:00.000Z" },
    { "id": "emb-zh-harbin", "language": "zh", "owner": { "tenantId": "tenant-embedding", "userId": "user-embedding", "agentId": "assistant-embedding" }, "sourceSessionId": "embedding-corpus", "content": "计划在冬季假期乘火车去哈尔滨。", "tags": [], "status": "active", "visibility": "recallable", "createdAt": "2026-08-01T00:06:00.000Z" },
    { "id": "emb-zh-standing", "language": "zh", "owner": { "tenantId": "tenant-embedding", "userId": "user-embedding", "agentId": "assistant-embedding" }, "sourceSessionId": "embedding-corpus", "content": "通常用站立式书桌处理远程工作。", "tags": [], "status": "active", "visibility": "recallable", "createdAt": "2026-08-01T00:07:00.000Z" },
    { "id": "emb-zh-cat-medicine", "language": "zh", "owner": { "tenantId": "tenant-embedding", "userId": "user-embedding", "agentId": "assistant-embedding" }, "sourceSessionId": "embedding-corpus", "content": "宠物猫需要在每晚九点服用药片。", "tags": [], "status": "active", "visibility": "recallable", "createdAt": "2026-08-01T00:08:00.000Z" },
    { "id": "emb-zh-emergency-contact", "language": "zh", "owner": { "tenantId": "tenant-embedding", "userId": "user-embedding", "agentId": "assistant-embedding" }, "sourceSessionId": "embedding-corpus", "content": "用户把紧急联系人设为姐姐林晓。", "tags": [], "status": "active", "visibility": "recallable", "createdAt": "2026-08-01T00:09:00.000Z" },
    { "id": "emb-en-bicycle", "language": "en", "owner": { "tenantId": "tenant-embedding", "userId": "user-embedding", "agentId": "assistant-embedding" }, "sourceSessionId": "embedding-corpus", "content": "The user commutes to the office by bicycle.", "tags": [], "status": "active", "visibility": "recallable", "createdAt": "2026-08-01T00:10:00.000Z" },
    { "id": "emb-en-oatmeal", "language": "en", "owner": { "tenantId": "tenant-embedding", "userId": "user-embedding", "agentId": "assistant-embedding" }, "sourceSessionId": "embedding-corpus", "content": "For breakfast, the user usually eats oatmeal with blueberries.", "tags": [], "status": "active", "visibility": "recallable", "createdAt": "2026-08-01T00:11:00.000Z" },
    { "id": "emb-en-thermostat", "language": "en", "owner": { "tenantId": "tenant-embedding", "userId": "user-embedding", "agentId": "assistant-embedding" }, "sourceSessionId": "embedding-corpus", "content": "The apartment thermostat is kept at twenty-one degrees Celsius.", "tags": [], "status": "active", "visibility": "recallable", "createdAt": "2026-08-01T00:12:00.000Z" },
    { "id": "emb-en-flights", "language": "en", "owner": { "tenantId": "tenant-embedding", "userId": "user-embedding", "agentId": "assistant-embedding" }, "sourceSessionId": "embedding-corpus", "content": "The user avoids red-eye flights because overnight travel causes headaches.", "tags": [], "status": "active", "visibility": "recallable", "createdAt": "2026-08-01T00:13:00.000Z" },
    { "id": "emb-en-code-review", "language": "en", "owner": { "tenantId": "tenant-embedding", "userId": "user-embedding", "agentId": "assistant-embedding" }, "sourceSessionId": "embedding-corpus", "content": "The preferred code review window is early Tuesday afternoon.", "tags": [], "status": "active", "visibility": "recallable", "createdAt": "2026-08-01T00:14:00.000Z" },
    { "id": "emb-en-photo-backup", "language": "en", "owner": { "tenantId": "tenant-embedding", "userId": "user-embedding", "agentId": "assistant-embedding" }, "sourceSessionId": "embedding-corpus", "content": "The user backs up photographs to an encrypted external drive.", "tags": [], "status": "active", "visibility": "recallable", "createdAt": "2026-08-01T00:15:00.000Z" },
    { "id": "emb-en-dog-command", "language": "en", "owner": { "tenantId": "tenant-embedding", "userId": "user-embedding", "agentId": "assistant-embedding" }, "sourceSessionId": "embedding-corpus", "content": "The dog responds to the recall command Juniper.", "tags": [], "status": "active", "visibility": "recallable", "createdAt": "2026-08-01T00:16:00.000Z" },
    { "id": "emb-en-book-donation", "language": "en", "owner": { "tenantId": "tenant-embedding", "userId": "user-embedding", "agentId": "assistant-embedding" }, "sourceSessionId": "embedding-corpus", "content": "The user donates unused books to the neighborhood library.", "tags": [], "status": "active", "visibility": "recallable", "createdAt": "2026-08-01T00:17:00.000Z" },
    { "id": "emb-en-eink", "language": "en", "owner": { "tenantId": "tenant-embedding", "userId": "user-embedding", "agentId": "assistant-embedding" }, "sourceSessionId": "embedding-corpus", "content": "Long technical articles are read on an e-ink tablet.", "tags": [], "status": "active", "visibility": "recallable", "createdAt": "2026-08-01T00:18:00.000Z" },
    { "id": "emb-en-emergency-fund", "language": "en", "owner": { "tenantId": "tenant-embedding", "userId": "user-embedding", "agentId": "assistant-embedding" }, "sourceSessionId": "embedding-corpus", "content": "The monthly budget reserves money for an emergency fund.", "tags": [], "status": "active", "visibility": "recallable", "createdAt": "2026-08-01T00:19:00.000Z" },
    { "id": "emb-exact-zh-passphrase", "language": "zh", "owner": { "tenantId": "tenant-embedding", "userId": "user-embedding", "agentId": "assistant-embedding" }, "sourceSessionId": "embedding-corpus", "content": "项目海风的发布口令是蓝鲸七号。", "tags": [], "status": "active", "visibility": "recallable", "createdAt": "2026-08-01T00:20:00.000Z" },
    { "id": "emb-exact-zh-passport", "language": "zh", "owner": { "tenantId": "tenant-embedding", "userId": "user-embedding", "agentId": "assistant-embedding" }, "sourceSessionId": "embedding-corpus", "content": "用户的护照续签预约定在九月十八日。", "tags": [], "status": "active", "visibility": "recallable", "createdAt": "2026-08-01T00:21:00.000Z" },
    { "id": "emb-exact-zh-port", "language": "zh", "owner": { "tenantId": "tenant-embedding", "userId": "user-embedding", "agentId": "assistant-embedding" }, "sourceSessionId": "embedding-corpus", "content": "备用数据库端口为6439。", "tags": [], "status": "active", "visibility": "recallable", "createdAt": "2026-08-01T00:22:00.000Z" },
    { "id": "emb-exact-en-checksum", "language": "en", "owner": { "tenantId": "tenant-embedding", "userId": "user-embedding", "agentId": "assistant-embedding" }, "sourceSessionId": "embedding-corpus", "content": "The Cedar deployment checksum is 7F3A9C.", "tags": [], "status": "active", "visibility": "recallable", "createdAt": "2026-08-01T00:23:00.000Z" },
    { "id": "emb-exact-en-dentist", "language": "en", "owner": { "tenantId": "tenant-embedding", "userId": "user-embedding", "agentId": "assistant-embedding" }, "sourceSessionId": "embedding-corpus", "content": "The dentist appointment begins at 08:40 on October fourth.", "tags": [], "status": "active", "visibility": "recallable", "createdAt": "2026-08-01T00:24:00.000Z" },
    { "id": "emb-exact-en-locker", "language": "en", "owner": { "tenantId": "tenant-embedding", "userId": "user-embedding", "agentId": "assistant-embedding" }, "sourceSessionId": "embedding-corpus", "content": "The recovery locker number is R-218.", "tags": [], "status": "active", "visibility": "recallable", "createdAt": "2026-08-01T00:25:00.000Z" },
    { "id": "emb-noise-zh-weekend", "language": "zh", "owner": { "tenantId": "tenant-embedding", "userId": "user-embedding", "agentId": "assistant-embedding" }, "sourceSessionId": "embedding-corpus", "content": "用户周末在家整理纸质照片。", "tags": [], "status": "active", "visibility": "recallable", "createdAt": "2026-08-01T00:26:00.000Z" },
    { "id": "emb-noise-zh-travel", "language": "zh", "owner": { "tenantId": "tenant-embedding", "userId": "user-embedding", "agentId": "assistant-embedding" }, "sourceSessionId": "embedding-corpus", "content": "出差时会把行李寄存在火车站。", "tags": [], "status": "active", "visibility": "recallable", "createdAt": "2026-08-01T00:27:00.000Z" },